{
  "schema_version": 1,
  "fixture_id": "val02-synthetic-domain-v1",
  "synthetic_only": true,
  "description": "完全虚构的 VAL-02 离线领域数据；名称、URL 与图片描述均不对应真实人物、作品、厂商或商品。",
  "media_policy": {
    "binary_committed": false,
    "generation": "dynamic_png",
    "identity_field": "storage_key",
    "exact_dedup_field": "sha256",
    "similarity_hint_field": "perceptual_hash"
  },
  "works": [
    {
      "id": "work-orbit-chronicles",
      "name": "星轨纪事",
      "original_name": "オービット・クロニクル",
      "aliases": ["Orbit Chronicle", "星轨"]
    },
    {
      "id": "work-moon-garden",
      "name": "月庭物语",
      "original_name": "ムーン・ガーデン",
      "aliases": ["Moon Garden", "月庭"]
    }
  ],
  "characters": [
    {
      "id": "character-lin-orbit",
      "display_name": "林",
      "names": {"zh": "林", "ja": "リン", "en": "Lin Orbit"},
      "aliases": ["轨道林", "Pilot Lin"],
      "work_id": "work-orbit-chronicles",
      "status": "active",
      "soft_deleted": false
    },
    {
      "id": "character-lin-moon",
      "display_name": "林",
      "names": {"zh": "林", "ja": "リン・ムーン", "en": "Lin Moon"},
      "aliases": ["月庭林", "Gardener Lin"],
      "work_id": "work-moon-garden",
      "status": "active",
      "soft_deleted": false
    },
    {
      "id": "character-aya",
      "display_name": "绫",
      "names": {"zh": "绫", "ja": "アヤ", "en": "Aya"},
      "aliases": ["星绫", "Navigator Aya"],
      "work_id": "work-orbit-chronicles",
      "status": "active",
      "soft_deleted": false
    },
    {
      "id": "character-ren",
      "display_name": "莲",
      "names": {"zh": "莲", "ja": "レン", "en": "Ren"},
      "aliases": ["庭莲", "Moon Ren"],
      "work_id": "work-moon-garden",
      "status": "active",
      "soft_deleted": false
    }
  ],
  "manufacturers": [
    {
      "id": "manufacturer-aurora",
      "canonical_name": "极光模型社",
      "aliases": ["Aurora Models"],
      "status": "active"
    },
    {
      "id": "manufacturer-lattice",
      "canonical_name": "格点造物",
      "aliases": ["Lattice Works"],
      "status": "active"
    },
    {
      "id": "manufacturer-sketch",
      "canonical_name": "素描工房",
      "aliases": ["Sketch Atelier"],
      "status": "draft"
    }
  ],
  "media": [
    {
      "id": "media-prototype-01-main",
      "owner_type": "figure_prototype",
      "owner_id": "prototype-orbit-lin-aurora",
      "source_url": "https://synthetic.invalid/media/prototype-01-main.png",
      "storage_key": "synthetic/prototypes/prototype-01/main.png",
      "generator": {"width": 48, "height": 72, "rgba": [72, 118, 210, 255]},
      "format": "PNG",
      "file_size": null,
      "sha256": null,
      "perceptual_hash": null,
      "is_adult": false,
      "is_source_homepage": true,
      "present_in_latest_source": true,
      "manually_selected_as_main": true
    },
    {
      "id": "media-prototype-05-main",
      "owner_type": "figure_prototype",
      "owner_id": "prototype-moon-ren-prize",
      "source_url": "https://synthetic.invalid/media/prototype-05-main.png",
      "storage_key": "synthetic/prototypes/prototype-05/main.png",
      "generator": {"width": 64, "height": 64, "rgba": [82, 158, 108, 255]},
      "format": "PNG",
      "file_size": null,
      "sha256": null,
      "perceptual_hash": null,
      "is_adult": false,
      "is_source_homepage": true,
      "present_in_latest_source": false,
      "manually_selected_as_main": true
    },
    {
      "id": "media-prototype-04-main",
      "owner_type": "figure_prototype",
      "owner_id": "prototype-moon-lin-variants",
      "source_url": "https://synthetic.invalid/media/prototype-04-main.png",
      "storage_key": "synthetic/prototypes/prototype-04/main.png",
      "generator": {"width": 54, "height": 81, "rgba": [138, 92, 164, 255]},
      "format": "PNG",
      "file_size": null,
      "sha256": null,
      "perceptual_hash": null,
      "is_adult": false,
      "is_source_homepage": true,
      "present_in_latest_source": true,
      "manually_selected_as_main": true
    }
  ],
  "figure_prototypes": [
    {
      "id": "prototype-orbit-lin-aurora",
      "title": "林·星跃姿态",
      "character_ids": ["character-lin-orbit"],
      "work_id": "work-orbit-chronicles",
      "manufacturer_id": "manufacturer-aurora",
      "figure_type": "scale",
      "scale": "1/7",
      "costume_text": "虚构蓝白航行服",
      "is_group": false,
      "is_adult": false,
      "publication_status": "published",
      "soft_deleted": false,
      "merged_into_id": null,
      "main_image_id": "media-prototype-01-main",
      "created_at": "2026-01-01T00:00:00Z",
      "updated_at": "2026-01-02T00:00:00Z"
    },
    {
      "id": "prototype-orbit-lin-lattice",
      "title": "林·星跃姿态（格点造物）",
      "character_ids": ["character-lin-orbit"],
      "work_id": "work-orbit-chronicles",
      "manufacturer_id": "manufacturer-lattice",
      "figure_type": "scale",
      "scale": "1/8",
      "costume_text": "虚构银灰航行服",
      "is_group": false,
      "is_adult": false,
      "publication_status": "published",
      "soft_deleted": false,
      "merged_into_id": null,
      "main_image_id": null,
      "created_at": "2026-01-03T00:00:00Z",
      "updated_at": "2026-01-03T00:00:00Z"
    },
    {
      "id": "prototype-orbit-duo",
      "title": "绫与林·双星导航",
      "character_ids": ["character-aya", "character-lin-orbit"],
      "work_id": "work-orbit-chronicles",
      "manufacturer_id": "manufacturer-aurora",
      "figure_type": "scale",
      "scale": "1/7",
      "costume_text": "虚构双人导航服",
      "is_group": true,
      "is_adult": false,
      "publication_status": "published",
      "soft_deleted": false,
      "merged_into_id": null,
      "main_image_id": null,
      "created_at": "2026-01-04T00:00:00Z",
      "updated_at": "2026-01-04T00:00:00Z"
    },
    {
      "id": "prototype-moon-lin-variants",
      "title": "林·月庭礼服",
      "character_ids": ["character-lin-moon"],
      "work_id": "work-moon-garden",
      "manufacturer_id": "manufacturer-lattice",
      "figure_type": "scale",
      "scale": "1/6",
      "costume_text": "虚构月色礼服",
      "is_group": false,
      "is_adult": true,
      "publication_status": "published",
      "soft_deleted": false,
      "merged_into_id": null,
      "main_image_id": "media-prototype-04-main",
      "created_at": "2026-01-05T00:00:00Z",
      "updated_at": "2026-01-05T00:00:00Z"
    },
    {
      "id": "prototype-moon-ren-prize",
      "title": "莲·月庭漫步",
      "character_ids": ["character-ren"],
      "work_id": "work-moon-garden",
      "manufacturer_id": "manufacturer-aurora",
      "figure_type": "prize",
      "scale": null,
      "costume_text": "虚构庭园便服",
      "is_group": false,
      "is_adult": false,
      "publication_status": "published",
      "soft_deleted": false,
      "merged_into_id": null,
      "main_image_id": "media-prototype-05-main",
      "created_at": "2026-01-06T00:00:00Z",
      "updated_at": "2026-01-06T00:00:00Z"
    }
  ],
  "figure_versions": [
    {"id": "version-p1-standard", "prototype_id": "prototype-orbit-lin-aurora", "kind": "standard", "name": "普通版"},
    {"id": "version-p2-standard", "prototype_id": "prototype-orbit-lin-lattice", "kind": "standard", "name": "普通版"},
    {"id": "version-p3-standard", "prototype_id": "prototype-orbit-duo", "kind": "standard", "name": "普通版"},
    {"id": "version-p4-standard", "prototype_id": "prototype-moon-lin-variants", "kind": "standard", "name": "普通版"},
    {"id": "version-p4-deluxe", "prototype_id": "prototype-moon-lin-variants", "kind": "deluxe", "name": "豪华版"},
    {"id": "version-p4-reissue", "prototype_id": "prototype-moon-lin-variants", "kind": "reissue", "name": "再版"},
    {"id": "version-p4-recolor", "prototype_id": "prototype-moon-lin-variants", "kind": "recolor", "name": "纯异色版"},
    {"id": "version-p5-standard", "prototype_id": "prototype-moon-ren-prize", "kind": "standard", "name": "普通版"}
  ],
  "source_records": [
    {
      "id": "source-p1",
      "prototype_id": "prototype-orbit-lin-aurora",
      "source_type": "synthetic_catalog",
      "source_item_id": "SYN-001",
      "source_url": "https://synthetic.invalid/items/SYN-001",
      "source_status": "active",
      "last_synced_at": "2026-01-10T00:00:00Z",
      "is_stale": false,
      "raw_snapshot": {"title": "林·星跃姿态", "revision": 1}
    },
    {
      "id": "source-p2",
      "prototype_id": "prototype-orbit-lin-lattice",
      "source_type": "synthetic_catalog",
      "source_item_id": "SYN-002",
      "source_url": "https://synthetic.invalid/items/SYN-002",
      "source_status": "active",
      "last_synced_at": "2026-01-10T00:00:00Z",
      "is_stale": false,
      "raw_snapshot": {"title": "林·星跃姿态（格点造物）", "revision": 1}
    },
    {
      "id": "source-p3",
      "prototype_id": "prototype-orbit-duo",
      "source_type": "synthetic_catalog",
      "source_item_id": "SYN-003",
      "source_url": "https://synthetic.invalid/items/SYN-003",
      "source_status": "active",
      "last_synced_at": "2026-01-10T00:00:00Z",
      "is_stale": false,
      "raw_snapshot": {"title": "绫与林·双星导航", "revision": 1}
    },
    {
      "id": "source-p4",
      "prototype_id": "prototype-moon-lin-variants",
      "source_type": "synthetic_catalog",
      "source_item_id": "SYN-004",
      "source_url": "https://synthetic.invalid/items/SYN-004",
      "source_status": "active",
      "last_synced_at": "2026-01-10T00:00:00Z",
      "is_stale": false,
      "raw_snapshot": {"title": "林·月庭礼服", "revision": 1}
    },
    {
      "id": "source-p5-stale",
      "prototype_id": "prototype-moon-ren-prize",
      "source_type": "synthetic_catalog",
      "source_item_id": "SYN-005",
      "source_url": "https://synthetic.invalid/items/SYN-005",
      "source_status": "missing",
      "last_synced_at": "2026-01-10T00:00:00Z",
      "is_stale": true,
      "raw_snapshot": {"title": "莲·月庭漫步", "revision": 1}
    }
  ],
  "candidate_records": [
    {
      "id": "candidate-new-unmatched",
      "source": {